02:06:24.619323 IP 134.122.36.143.22 > 99.231.74.232.12286: Flags [P.], seq 29391808:29391972, ack 16345, win 501, length 164
02:06:24.619383 IP 134.122.36.143.22 > 99.231.74.232.12286: Flags [P.], seq 29391972:29392136, ack 16345, win 501, length 164
02:06:24.619439 IP 134.122.36.143.22 > 99.231.74.232.12286: Flags [P.], seq 29392136:29392300, ack 16345, win 501, length 164
02:06:24.619499 IP 134.122.36.143.22 > 99.231.74.232.12286: Flags [P.], seq 29392300:29392464, ack 16345, win 501, length 164
02:06:24.619555 IP 134.122.36.143.22 > 99.231.74.232.12286: Flags [P.], seq 29392464:29392628, ack 16345, win 501, length 164
02:06:24.619612 IP 134.122.36.143.22 > 99.231.74.232.12286: Flags [P.], seq 29392628:29392792, ack 16345, win 501, length 164
02:06:24.619667 IP 134.122.36.143.22 > 99.231.74.232.12286: Flags [P.], seq 29392792:29392956, ack 16345, win 501, length 164
02:06:24.619724 IP 134.122.36.143.22 > 99.231.74.232.12286: Flags [P.], seq 29392956:29393120, ack 16345, win 501, length 164
02:06:24.619781 IP 134.122.36.143.22 > 99.231.74.232.12286: Flags [P.], seq 29393120:29393284, ack 16345, win 501, length 164
02:06:24.619835 IP 134.122.36.143.22 > 99.231.74.232.12286: Flags [P.], seq 29393284:29393448, ack 16345, win 501, length 164
02:06:24.619888 IP 134.122.36.143.22 > 99.231.74.232.12286: Flags [P.], seq 29393448:29393612, ack 16345, win 501, length 164
02:06:24.619947 IP 134.122.36.143.22 > 99.231.74.232.12286: Flags [P.], seq 29393612:29393776, ack 16345, win 501, length 164
02:06:24.620003 IP 134.122.36.143.22 > 99.231.74.232.12286: Flags [P.], seq 29393776:29393940, ack 16345, win 501, length 164
02:06:24.620060 IP 134.122.36.143.22 > 99.231.74.232.12286: Flags [P.], seq 29393940:29394104, ack 16345, win 501, length 164
02:06:24.620164 IP 134.122.36.143.22 > 99.231.74.232.12286: Flags [P.], seq 29394104:29394268, ack 16345, win 501, length 164
02:06:24.620284 IP 134.122.36.143.22 > 99.231.74.232.12286: Flags [P.], seq 29394268:29394432, ack 16345, win 501, length 164
02:06:24.620345 IP 134.122.36.143.22 > 99.231.74.232.12286: Flags [P.], seq 29394432:29394596, ack 16345, win 501, length 164
02:06:24.620404 IP 134.122.36.143.22 > 99.231.74.232.12286: Flags [P.], seq 29394596:29394760, ack 16345, win 501, length 164
02:06:24.620463 IP 134.122.36.143.22 > 99.231.74.232.12286: Flags [P.], seq 29394760:29394924, ack 16345, win 501, length 164
02:06:24.620522 IP 134.122.36.143.22 > 99.231.74.232.12286: Flags [P.], seq 29394924:29395088, ack 16345, win 501, length 164
02:06:24.620578 IP 134.122.36.143.22 > 99.231.74.232.12286: Flags [P.], seq 29395088:29395252, ack 16345, win 501, length 164
02:06:24.620634 IP 134.122.36.143.22 > 99.231.74.232.12286: Flags [P.], seq 29395252:29395416, ack 16345, win 501, length 164
02:06:24.620700 IP 134.122.36.143.22 > 99.231.74.232.12286: Flags [P.], seq 29395416:29395580, ack 16345, win 501, length 164
02:06:24.620760 IP 134.122.36.143.22 > 99.231.74.232.12286: Flags [P.], seq 29395580:29395744, ack 16345, win 501, length 164
02:06:24.620814 IP 134.122.36.143.22 > 99.231.74.232.12286: Flags [P.], seq 29395744:29395908, ack 16345, win 501, length 164
02:06:24.620868 IP 134.122.36.143.22 > 99.231.74.232.12286: Flags [P.], seq 29395908:29396072, ack 16345, win 501, length 164
02:06:24.620923 IP 134.122.36.143.22 > 99.231.74.232.12286: Flags [P.], seq 29396072:29396236, ack 16345, win 501, length 164
02:06:24.620984 IP 134.122.36.143.22 > 99.231.74.232.12286: Flags [P.], seq 29396236:29396400, ack 16345, win 501, length 164
02:06:24.621041 IP 134.122.36.143.22 > 99.231.74.232.12286: Flags [P.], seq 29396400:29396564, ack 16345, win 501, length 164
02:06:24.621097 IP 134.122.36.143.22 > 99.231.74.232.12286: Flags [P.], seq 29396564:29396728, ack 16345, win 501, length 164
02:06:24.621151 IP 134.122.36.143.22 > 99.231.74.232.12286: Flags [P.], seq 29396728:29396892, ack 16345, win 501, length 164
02:06:24.621205 IP 134.122.36.143.22 > 99.231.74.232.12286: Flags [P.], seq 29396892:29397056, ack 16345, win 501, length 164
02:06:24.621258 IP 134.122.36.143.22 > 99.231.74.232.12286: Flags [P.], seq 29397056:29397220, ack 16345, win 501, length 164
02:06:24.621316 IP 134.122.36.143.22 > 99.231.74.232.12286: Flags [P.], seq 29397220:29397384, ack 16345, win 501, length 164
02:06:24.621372 IP 134.122.36.143.22 > 99.231.74.232.12286: Flags [P.], seq 29397384:29397548, ack 16345, win 501, length 164
02:06:24.621431 IP 134.122.36.143.22 > 99.231.74.232.12286: Flags [P.], seq 29397548:29397712, ack 16345, win 501, length 164
02:06:24.621487 IP 134.122.36.143.22 > 99.231.74.232.12286: Flags [P.], seq 29397712:29397876, ack 16345, win 501, length 164
02:06:24.621542 IP 134.122.36.143.22 > 99.231.74.232.12286: Flags [P.], seq 29397876:29398040, ack 16345, win 501, length 164
02:06:24.621600 IP 134.122.36.143.22 > 99.231.74.232.12286: Flags [P.], seq 29398040:29398204, ack 16345, win 501, length 164
02:06:24.621656 IP 134.122.36.143.22 > 99.231.74.232.12286: Flags [P.], seq 29398204:29398368, ack 16345, win 501, length 164
02:06:24.621710 IP 134.122.36.143.22 > 99.231.74.232.12286: Flags [P.], seq 29398368:29398532, ack 16345, win 501, length 164
02:06:24.621767 IP 134.122.36.143.22 > 99.231.74.232.12286: Flags [P.], seq 29398532:29398696, ack 16345, win 501, length 164
02:06:24.621830 IP 134.122.36.143.22 > 99.231.74.232.12286: Flags [P.], seq 29398696:29398860, ack 16345, win 501, length 164
02:06:24.621891 IP 134.122.36.143.22 > 99.231.74.232.12286: Flags [P.], seq 29398860:29399024, ack 16345, win 501, length 164
02:06:24.621947 IP 134.122.36.143.22 > 99.231.74.232.12286: Flags [P.], seq 29399024:29399188, ack 16345, win 501, length 164
02:06:24.622050 IP 134.122.36.143.22 > 99.231.74.232.12286: Flags [P.], seq 29399188:29399352, ack 16345, win 501, length 164
02:06:24.622143 IP 134.122.36.143.22 > 99.231.74.232.12286: Flags [P.], seq 29399352:29399516, ack 16345, win 501, length 164
02:06:24.622218 IP 134.122.36.143.22 > 99.231.74.232.12286: Flags [P.], seq 29399516:29399680, ack 16345, win 501, length 164
02:06:24.622259 IP 99.231.74.232.12286 > 134.122.36.143.22: Flags [.], ack 29350036, win 1021, length 0
02:06:24.622291 IP 99.231.74.232.12286 > 134.122.36.143.22: Flags [.], ack 29350528, win 1026, length 0
02:06:24.622334 IP 99.231.74.232.12286 > 134.122.36.143.22: Flags [P.], seq 16345:16381, ack 29351676, win 1022, length 36
02:06:24.622334 IP 99.231.74.232.12286 > 134.122.36.143.22: Flags [.], ack 29355284, win 1023, length 0
02:06:24.622334 IP 99.231.74.232.12286 > 134.122.36.143.22: Flags [.], ack 29357744, win 1026, length 0
02:06:24.622334 IP 99.231.74.232.12286 > 134.122.36.143.22: Flags [.], ack 29361716, win 1026, length 0
02:06:24.622394 IP 99.231.74.232.12286 > 134.122.36.143.22: Flags [.], ack 29364504, win 1021, length 0
02:06:24.622394 IP 99.231.74.232.12286 > 134.122.36.143.22: Flags [.], ack 29366800, win 1024, length 0
02:06:24.622395 IP 99.231.74.232.12286 > 134.122.36.143.22: Flags [.], ack 29371228, win 1022, length 0
^C
183406 packets captured
183460 packets received by filter
54 packets dropped by kernel